### ISSUE TITLE
SMPP connection suddenly down

### ISSUE THREAD

**Issue by geethupendra** [jookies/jasmin#1079]
Hello Team,

I have using Jasmin and working fine. there is an issue I facing and trouble with disconnection. at that time i check PING the connection but it was pinging ISP connection OK, I tried **FailoverMTRoute** also but still the same. 

suddenly down and retry take long time (like 3m...)

please find the log details and SMPP connection settings

LOG Details
----------------------------
==> /var/log/jasmin/default-MT_deft.log <==
2022-10-07 22:49:41 ERROR    32477 Request timed out after 120 secs: PDU [command: enquire_link, sequence_number: 336, command_status: ESME_ROK]
2022-10-07 22:49:42 WARNING  32477 Issuing unbind request

==> /var/log/jasmin/default-MT_smpp_b1.log <==
2022-10-07 22:49:42 INFO     32477 Connecting to IPv4Address(TCP, '10.10.10.20', 2775) ...
2022-10-07 22:49:42 WARNING  32477 SMPP connection established from 10.10.10.20 to port 54414
2022-10-07 22:49:42 INFO     32477 Connection made to 10.10.10.20:2775
2022-10-07 22:49:42 WARNING  32477 Requesting bind as transceiver
2022-10-07 22:49:42 WARNING  32477 Bind succeeded...now in state BOUND_TRX

==> /var/log/jasmin/default-MT_smpp.log <==
2022-10-07 22:49:43 ERROR    32477 Request timed out after 120 secs: PDU [command: enquire_link, sequence_number: 370, command_status: ESME_ROK]

==> /var/log/jasmin/default-MT_deft.log <==
2022-10-07 22:49:52 ERROR    32477 Request timed out after 10 secs: PDU [command: unbind, sequence_number: 337, command_status: ESME_ROK]
2022-10-07 22:49:52 ERROR    32477 Unbind failed [[Failure instance: Traceback (failure with no frames): <class 'jasmin.vendor.smpp.pdu.error.SMPPRequestTimoutError'>: Request timed out after 10 secs: PDU [command: unbind, sequence_number: 337, command_status: ESME_ROK]]]. Disconnecting...
2022-10-07 22:49:52 WARNING  32477 Disconnecting...
2022-10-07 22:49:52 WARNING  32477 Disconnecting...
2022-10-07 22:49:52 WARNING  32477 Shutdown requested...disconnecting
2022-10-07 22:49:52 WARNING  32477 Disconnecting...
2022-10-07 22:49:52 WARNING  32477 SMPP 10.10.10.10 disconnected from port 38900: [Failure instance: Traceback (failure with no frames): <class 'twisted.internet.error.ConnectionDone'>: Connection was closed cleanly.]
2022-10-07 22:49:52 ERROR    32477 Connection lost. Reason: [Failure instance: Traceback (failure with no frames): <class 'twisted.internet.error.ConnectionDone'>: Connection was closed cleanly.]
2022-10-07 22:49:52 INFO     32477 Reconnecting after 10 seconds ...
2022-10-07 22:50:02 INFO     32477 Connecting to IPv4Address(TCP, '10.10.10.10', 2775) ...
2022-10-07 22:50:02 WARNING  32477 SMPP connection established from 10.10.10.10 to port 38828
2022-10-07 22:50:02 INFO     32477 Connection made to 10.10.10.10:2775
2022-10-07 22:50:02 WARNING  32477 Requesting bind as transceiver
2022-10-07 22:50:02 WARNING  32477 Bind succeeded...now in state BOUND_TRX

==> /var/log/jasmin/default-MT_smpp.log <==
2022-10-07 22:50:09 ERROR    32477 Request timed out after 120 secs: PDU [command: submit_sm, sequence_number: 371, command_status: ESME_ROK
service_type: None
source_addr_ton: 'ALPHANUMERIC'
source_addr_npi: 'ISDN'
source_addr: 'KZONE'
dest_addr_ton: 'INTERNATIONAL'
dest_addr_npi: 'ISDN'
destination_addr: '94777123456'
esm_class: EsmClass[mode: STORE_AND_FORWARD, type: DEFAULT, gsmFeatures: set([])]
protocol_id: None
priority_flag: 'LEVEL_3'
schedule_delivery_time: None
validity_period: datetime.datetime(2022, 10, 9, 22, 48, 9, 570424)
registered_delivery: RegisteredDelivery[receipt: SMSC_DELIVERY_RECEIPT_REQUESTED, smeOriginatedAcks: set([]), intermediateNotification: False]
replace_if_present_flag: 'DO_NOT_REPLACE'
data_coding: DataCoding[scheme: DEFAULT, schemeData: SMSC_DEFAULT_ALPHABET]
sm_default_msg_id: 0
short_message: 'NW22405049 Payment Received2,300.00 Acc#031345511002 Thank you']

==> /var/log/jasmin/messages.log <==
2022-10-07 22:50:09 ERROR    32477 SubmitSmPDU[e36cde95-edb5-439e-914f-310eb1b708f5] request timed out through [cid:MT_smpp], message requeued.

==> /var/log/jasmin/default-MT_smpp.log <==
2022-10-07 22:50:09 WARNING  32477 Issuing unbind request

==> /var/log/jasmin/messages.log <==
2022-10-07 22:50:13 ERROR    32477 SMPPC [cid:MT_smpp] is not bound: Requeuing (#2) SubmitSmPDU[4e7f1dff-9a4e-4464-bef4-f110ea8c5196], aged 0:03:00.005790 seconds.
2022-10-07 22:50:13 ERROR    32477 SMPPC [cid:MT_smpp] is not bound: Requeuing (#4) SubmitSmPDU[4e7f1dff-9a4e-4464-bef4-f110ea8c5196], aged 0:03:00.078895 seconds.
2022-10-07 22:50:13 ERROR    32477 SMPPC [cid:MT_smpp] is not bound: Requeuing (#6) SubmitSmPDU[4e7f1dff-9a4e-4464-bef4-f110ea8c5196], aged 0:03:00.151962 seconds.
2022-10-07 22:50:13 ERROR    32477 SMPPC [cid:MT_smpp] is not bound: Requeuing (#8) SubmitSmPDU[4e7f1dff-9a4e-4464-bef4-f110ea8c5196], aged 0:03:00.225208 seconds.
2022-10-07 22:50:13 ERROR    32477 SMPPC [cid:MT_smpp] is not bound: Requeuing (#10) SubmitSmPDU[4e7f1dff-9a4e-4464-bef4-f110ea8c5196], aged 0:03:00.298323 seconds.
2022-10-07 22:50:13 ERROR    32477 SMPPC [cid:MT_smpp] is not bound: Requeuing (#12) SubmitSmPDU[4e7f1dff-9a4e-4464-bef4-f110ea8c5196], aged 0:03:00.371299 seconds.
2022-10-07 22:50:13 ERROR    32477 SMPPC [cid:MT_smpp] is not bound: Requeuing (#14) SubmitSmPDU[4e7f1dff-9a4e-4464-bef4-f110ea8c5196], aged 0:03:00.444603 seconds.
2022-10-07 22:50:13 ERROR    32477 SMPPC [cid:MT_smpp] is not bound: Requeuing (#16) SubmitSmPDU[4e7f1dff-9a4e-4464-bef4-f110ea8c5196], aged 0:03:00.517835 seconds.
2022-10-07 22:50:13 ERROR    32477 SMPPC [cid:MT_smpp] is not bound: Requeuing (#18) SubmitSmPDU[4e7f1dff-9a4e-4464-bef4-f110ea8c5196], aged 0:03:00.590934 seconds.
2022-10-07 22:50:13 ERROR    32477 SMPPC [cid:MT_smpp] is not bound: Requeuing (#20) SubmitSmPDU[4e7f1dff-9a4e-4464-bef4-f110ea8c5196], aged 0:03:00.664157 seconds.
2022-10-07 22:50:14 ERROR    32477 SMPPC [cid:MT_smpp] is not bound: Requeuing (#22) SubmitSmPDU[4e7f1dff-9a4e-4464-bef4-f110ea8c5196], aged 0:03:00.737193 seconds.
2022-10-07 22:50:14 ERROR    32477 SMPPC [cid:MT_smpp] is not bound: Requeuing (#24) SubmitSmPDU[4e7f1dff-9a4e-4464-bef4-f110ea8c5196], aged 0:03:00.810228 seconds.
2022-10-07 22:50:14 ERROR    32477 SMPPC [cid:MT_smpp] is not bound: Requeuing (#26) SubmitSmPDU[4e7f1dff-9a4e-4464-bef4-f110ea8c5196], aged 0:03:00.883412 seconds.
2022-10-07 22:50:14 ERROR    32477 SMPPC [cid:MT_smpp] is not bound: Requeuing (#28) SubmitSmPDU[4e7f1dff-9a4e-4464-bef4-f110ea8c5196], aged 0:03:00.956462 seconds.
2022-10-07 22:50:14 ERROR    32477 SMPPC [cid:MT_smpp] is not bound: Requeuing (#30) SubmitSmPDU[4e7f1dff-9a4e-4464-bef4-f110ea8c5196], aged 0:03:01.029467 seconds.
2022-10-07 22:50:14 ERROR    32477 SMPPC [cid:MT_smpp] is not bound: Requeuing (#32) SubmitSmPDU[4e7f1dff-9a4e-4464-bef4-f110ea8c5196], aged 0:03:01.102741 seconds.
2022-10-07 22:50:14 ERROR    32477 SMPPC [cid:MT_smpp] is not bound: Requeuing (#34) SubmitSmPDU[4e7f1dff-9a4e-4464-bef4-f110ea8c5196], aged 0:03:01.175801 seconds.
2022-10-07 22:50:14 ERROR    32477 SMPPC [cid:MT_smpp] is not bound: Requeuing (#36) SubmitSmPDU[4e7f1dff-9a4e-4464-bef4-f110ea8c5196], aged 0:03:01.248893 seconds.
2022-10-07 22:50:14 ERROR    32477 SMPPC [cid:MT_smpp] is not bound: Requeuing (#38) SubmitSmPDU[4e7f1dff-9a4e-4464-bef4-f110ea8c5196], aged 0:03:01.322111 seconds.
2022-10-07 22:50:14 ERROR    32477 SMPPC [cid:MT_smpp] is not bound: Requeuing (#40) SubmitSmPDU[4e7f1dff-9a4e-4464-bef4-f110ea8c5196], aged 0:03:01.395189 seconds.
2022-10-07 22:50:14 ERROR    32477 SMPPC [cid:MT_smpp] is not bound: Requeuing (#42) SubmitSmPDU[4e7f1dff-9a4e-4464-bef4-f110ea8c5196], aged 0:03:01.468228 seconds.
2022-10-07 22:50:14 ERROR    32477 SMPPC [cid:MT_smpp] is not bound: Requeuing (#44) SubmitSmPDU[4e7f1dff-9a4e-4464-bef4-f110ea8c5196], aged 0:03:01.541461 seconds.
2022-10-07 22:50:14 ERROR    32477 SMPPC [cid:MT_smpp] is not bound: Requeuing (#46) SubmitSmPDU[4e7f1dff-9a4e-4464-bef4-f110ea8c5196], aged 0:03:01.614590 seconds.
2022-10-07 22:50:15 ERROR    32477 SMPPC [cid:MT_smpp] is not bound: Requeuing (#48) SubmitSmPDU[4e7f1dff-9a4e-4464-bef4-f110ea8c5196], aged 0:03:01.687685 seconds.
2022-10-07 22:50:15 ERROR    32477 SMPPC [cid:MT_smpp] is not bound: Requeuing (#50) SubmitSmPDU[4e7f1dff-9a4e-4464-bef4-f110ea8c5196], aged 0:03:01.760988 seconds.
2022-10-07 22:50:15 ERROR    32477 SMPPC [cid:MT_smpp] is not bound: Requeuing (#52) SubmitSmPDU[4e7f1dff-9a4e-4464-bef4-f110ea8c5196], aged 0:03:01.834068 seconds.
2022-10-07 22:50:15 ERROR    32477 SMPPC [cid:MT_smpp] is not bound: Requeuing (#54) SubmitSmPDU[4e7f1dff-9a4e-4464-bef4-f110ea8c5196], aged 0:03:01.907178 seconds.
2022-10-07 22:50:15 ERROR    32477 SMPPC [cid:MT_smpp] is not bound: Requeuing (#56) SubmitSmPDU[4e7f1dff-9a4e-4464-bef4-f110ea8c5196], aged 0:03:01.980448 seconds.
2022-10-07 22:50:15 ERROR    32477 SMPPC [cid:MT_smpp] is not bound: Requeuing (#58) SubmitSmPDU[4e7f1dff-9a4e-4464-bef4-f110ea8c5196], aged 0:03:02.053559 seconds.
2022-10-07 22:50:15 ERROR    32477 SMPPC [cid:MT_smpp] is not bound: Requeuing (#60) SubmitSmPDU[4e7f1dff-9a4e-4464-bef4-f110ea8c5196], aged 0:03:02.126664 seconds.
2022-10-07 22:50:15 ERROR    32477 SMPPC [cid:MT_smpp] is not bound: Requeuing (#62) SubmitSmPDU[4e7f1dff-9a4e-4464-bef4-f110ea8c5196], aged 0:03:02.199948 seconds.
2022-10-07 22:50:15 ERROR    32477 SMPPC [cid:MT_smpp] is not bound: Requeuing (#64) SubmitSmPDU[4e7f1dff-9a4e-4464-bef4-f110ea8c5196], aged 0:03:02.273080 seconds.
2022-10-07 22:50:15 ERROR    32477 SMPPC [cid:MT_smpp] is not bound: Requeuing (#66) SubmitSmPDU[4e7f1dff-9a4e-4464-bef4-f110ea8c5196], aged 0:03:02.346356 seconds.
2022-10-07 22:50:15 ERROR    32477 SMPPC [cid:MT_smpp] is not bound: Requeuing (#68) SubmitSmPDU[4e7f1dff-9a4e-4464-bef4-f110ea8c5196], aged 0:03:02.419693 seconds.
2022-10-07 22:50:15 ERROR    32477 SMPPC [cid:MT_smpp] is not bound: Requeuing (#70) SubmitSmPDU[4e7f1dff-9a4e-4464-bef4-f110ea8c5196], aged 0:03:02.492902 seconds.
2022-10-07 22:50:15 ERROR    32477 SMPPC [cid:MT_smpp] is not bound: Requeuing (#72) SubmitSmPDU[4e7f1dff-9a4e-4464-bef4-f110ea8c5196], aged 0:03:02.566056 seconds.
2022-10-07 22:50:15 ERROR    32477 SMPPC [cid:MT_smpp] is not bound: Requeuing (#74) SubmitSmPDU[4e7f1dff-9a4e-4464-bef4-f110ea8c5196], aged 0:03:02.639378 seconds.
2022-10-07 22:50:16 ERROR    32477 SMPPC [cid:MT_smpp] is not bound: Requeuing (#76) SubmitSmPDU[4e7f1dff-9a4e-4464-bef4-f110ea8c5196], aged 0:03:02.712509 seconds.
2022-10-07 22:50:16 ERROR    32477 SMPPC [cid:MT_smpp] is not bound: Requeuing (#78) SubmitSmPDU[4e7f1dff-9a4e-4464-bef4-f110ea8c5196], aged 0:03:02.785728 seconds.
2022-10-07 22:50:16 ERROR    32477 SMPPC [cid:MT_smpp] is not bound: Requeuing (#80) SubmitSmPDU[4e7f1dff-9a4e-4464-bef4-f110ea8c5196], aged 0:03:02.859107 seconds.
2022-10-07 22:50:16 ERROR    32477 SMPPC [cid:MT_smpp] is not bound: Requeuing (#82) SubmitSmPDU[4e7f1dff-9a4e-4464-bef4-f110ea8c5196], aged 0:03:02.931822 seconds.
2022-10-07 22:50:16 ERROR    32477 SMPPC [cid:MT_smpp] is not bound: Requeuing (#84) SubmitSmPDU[4e7f1dff-9a4e-4464-bef4-f110ea8c5196], aged 0:03:03.004898 seconds.
2022-10-07 22:50:16 ERROR    32477 SMPPC [cid:MT_smpp] is not bound: Requeuing (#86) SubmitSmPDU[4e7f1dff-9a4e-4464-bef4-f110ea8c5196], aged 0:03:03.078131 seconds.
2022-10-07 22:50:16 ERROR    32477 SMPPC [cid:MT_smpp] is not bound: Requeuing (#88) SubmitSmPDU[4e7f1dff-9a4e-4464-bef4-f110ea8c5196], aged 0:03:03.151269 seconds.
2022-10-07 22:50:16 ERROR    32477 SMPPC [cid:MT_smpp] is not bound: Requeuing (#90) SubmitSmPDU[4e7f1dff-9a4e-4464-bef4-f110ea8c5196], aged 0:03:03.224541 seconds.
2022-10-07 22:50:16 ERROR    32477 SMPPC [cid:MT_smpp] is not bound: Requeuing (#92) SubmitSmPDU[4e7f1dff-9a4e-4464-bef4-f110ea8c5196], aged 0:03:03.297735 seconds.
2022-10-07 22:50:16 ERROR    32477 SMPPC [cid:MT_smpp] is not bound: Requeuing (#94) SubmitSmPDU[4e7f1dff-9a4e-4464-bef4-f110ea8c5196], aged 0:03:03.370797 seconds.
2022-10-07 22:50:16 ERROR    32477 SMPPC [cid:MT_smpp] is not bound: Requeuing (#96) SubmitSmPDU[4e7f1dff-9a4e-4464-bef4-f110ea8c5196], aged 0:03:03.443900 seconds.
2022-10-07 22:50:16 ERROR    32477 SMPPC [cid:MT_smpp] is not bound: Requeuing (#98) SubmitSmPDU[4e7f1dff-9a4e-4464-bef4-f110ea8c5196], aged 0:03:03.517160 seconds.
2022-10-07 22:50:16 ERROR    32477 SMPPC [cid:MT_smpp] is not bound: Requeuing (#100) SubmitSmPDU[4e7f1dff-9a4e-4464-bef4-f110ea8c5196], aged 0:03:03.590265 seconds.
2022-10-07 22:50:16 ERROR    32477 SMPPC [cid:MT_smpp] is not bound: Requeuing (#102) SubmitSmPDU[4e7f1dff-9a4e-4464-bef4-f110ea8c5196], aged 0:03:03.663354 seconds.
2022-10-07 22:50:17 ERROR    32477 SMPPC [cid:MT_smpp] is not bound: Requeuing (#104) SubmitSmPDU[4e7f1dff-9a4e-4464-bef4-f110ea8c5196], aged 0:03:03.736556 seconds.
2022-10-07 22:50:17 ERROR    32477 SMPPC [cid:MT_smpp] is not bound: Requeuing (#106) SubmitSmPDU[4e7f1dff-9a4e-4464-bef4-f110ea8c5196], aged 0:03:03.809612 seconds.
2022-10-07 22:50:17 ERROR    32477 SMPPC [cid:MT_smpp] is not bound: Requeuing (#108) SubmitSmPDU[4e7f1dff-9a4e-4464-bef4-f110ea8c5196], aged 0:03:03.882641 seconds.
2022-10-07 22:50:17 ERROR    32477 SMPPC [cid:MT_smpp] is not bound: Requeuing (#110) SubmitSmPDU[4e7f1dff-9a4e-4464-bef4-f110ea8c5196], aged 0:03:03.955782 seconds.
2022-10-07 22:50:17 ERROR    32477 SMPPC [cid:MT_smpp] is not bound: Requeuing (#112) SubmitSmPDU[4e7f1dff-9a4e-4464-bef4-f110ea8c5196], aged 0:03:04.028892 seconds.
2022-10-07 22:50:17 ERROR    32477 SMPPC [cid:MT_smpp] is not bound: Requeuing (#114) SubmitSmPDU[4e7f1dff-9a4e-4464-bef4-f110ea8c5196], aged 0:03:04.101939 seconds.
2022-10-07 22:50:17 ERROR    32477 SMPPC [cid:MT_smpp] is not bound: Requeuing (#116) SubmitSmPDU[4e7f1dff-9a4e-4464-bef4-f110ea8c5196], aged 0:03:04.175149 seconds.
2022-10-07 22:50:17 ERROR    32477 SMPPC [cid:MT_smpp] is not bound: Requeuing (#118) SubmitSmPDU[4e7f1dff-9a4e-4464-bef4-f110ea8c5196], aged 0:03:04.248148 seconds.
2022-10-07 22:50:17 ERROR    32477 SMPPC [cid:MT_smpp] is not bound: Requeuing (#120) SubmitSmPDU[4e7f1dff-9a4e-4464-bef4-f110ea8c5196], aged 0:03:04.321280 seconds.
2022-10-07 22:50:17 ERROR    32477 SMPPC [cid:MT_smpp] is not bound: Requeuing (#122) SubmitSmPDU[4e7f1dff-9a4e-4464-bef4-f110ea8c5196], aged 0:03:04.394631 seconds.
2022-10-07 22:50:17 ERROR    32477 SMPPC [cid:MT_smpp] is not bound: Requeuing (#124) SubmitSmPDU[4e7f1dff-9a4e-4464-bef4-f110ea8c5196], aged 0:03:04.467632 seconds.
2022-10-07 22:50:17 ERROR    32477 SMPPC [cid:MT_smpp] is not bound: Requeuing (#126) SubmitSmPDU[4e7f1dff-9a4e-4464-bef4-f110ea8c5196], aged 0:03:04.540683 seconds.
2022-10-07 22:50:17 ERROR    32477 SMPPC [cid:MT_smpp] is not bound: Requeuing (#128) SubmitSmPDU[4e7f1dff-9a4e-4464-bef4-f110ea8c5196], aged 0:03:04.613889 seconds.
2022-10-07 22:50:18 ERROR    32477 SMPPC [cid:MT_smpp] is not bound: Requeuing (#130) SubmitSmPDU[4e7f1dff-9a4e-4464-bef4-f110ea8c5196], aged 0:03:04.687083 seconds.
2022-10-07 22:50:18 ERROR    32477 SMPPC [cid:MT_smpp] is not bound: Requeuing (#132) SubmitSmPDU[4e7f1dff-9a4e-4464-bef4-f110ea8c5196], aged 0:03:04.759926 seconds.
2022-10-07 22:50:18 ERROR    32477 SMPPC [cid:MT_smpp] is not bound: Requeuing (#134) SubmitSmPDU[4e7f1dff-9a4e-4464-bef4-f110ea8c5196], aged 0:03:04.832847 seconds.
2022-10-07 22:50:18 ERROR    32477 SMPPC [cid:MT_smpp] is not bound: Requeuing (#136) SubmitSmPDU[4e7f1dff-9a4e-4464-bef4-f110ea8c5196], aged 0:03:04.905732 seconds.
2022-10-07 22:50:18 ERROR    32477 SMPPC [cid:MT_smpp] is not bound: Requeuing (#138) SubmitSmPDU[4e7f1dff-9a4e-4464-bef4-f110ea8c5196], aged 0:03:04.978397 seconds.
2022-10-07 22:50:18 ERROR    32477 SMPPC [cid:MT_smpp] is not bound: Requeuing (#140) SubmitSmPDU[4e7f1dff-9a4e-4464-bef4-f110ea8c5196], aged 0:03:05.051645 seconds.
2022-10-07 22:50:18 ERROR    32477 SMPPC [cid:MT_smpp] is not bound: Requeuing (#142) SubmitSmPDU[4e7f1dff-9a4e-4464-bef4-f110ea8c5196], aged 0:03:05.124557 seconds.
2022-10-07 22:50:18 ERROR    32477 SMPPC [cid:MT_smpp] is not bound: Requeuing (#144) SubmitSmPDU[4e7f1dff-9a4e-4464-bef4-f110ea8c5196], aged 0:03:05.197570 seconds.
2022-10-07 22:50:18 ERROR    32477 SMPPC [cid:MT_smpp] is not bound: Requeuing (#146) SubmitSmPDU[4e7f1dff-9a4e-4464-bef4-f110ea8c5196], aged 0:03:05.270829 seconds.
2022-10-07 22:50:18 ERROR    32477 SMPPC [cid:MT_smpp] is not bound: Requeuing (#148) SubmitSmPDU[4e7f1dff-9a4e-4464-bef4-f110ea8c5196], aged 0:03:05.343720 seconds.
2022-10-07 22:50:18 ERROR    32477 SMPPC [cid:MT_smpp] is not bound: Requeuing (#150) SubmitSmPDU[4e7f1dff-9a4e-4464-bef4-f110ea8c5196], aged 0:03:05.416544 seconds.
2022-10-07 22:50:18 ERROR    32477 SMPPC [cid:MT_smpp] is not bound: Requeuing (#152) SubmitSmPDU[4e7f1dff-9a4e-4464-bef4-f110ea8c5196], aged 0:03:05.490045 seconds.
2022-10-07 22:50:18 ERROR    32477 SMPPC [cid:MT_smpp] is not bound: Requeuing (#154) SubmitSmPDU[4e7f1dff-9a4e-4464-bef4-f110ea8c5196], aged 0:03:05.563147 seconds.
2022-10-07 22:50:18 ERROR    32477 SMPPC [cid:MT_smpp] is not bound: Requeuing (#156) SubmitSmPDU[4e7f1dff-9a4e-4464-bef4-f110ea8c5196], aged 0:03:05.636375 seconds.
2022-10-07 22:50:19 ERROR    32477 SMPPC [cid:MT_smpp] is not bound: Requeuing (#158) SubmitSmPDU[4e7f1dff-9a4e-4464-bef4-f110ea8c5196], aged 0:03:05.709531 seconds.
2022-10-07 22:50:19 ERROR    32477 SMPPC [cid:MT_smpp] is not bound: Requeuing (#160) SubmitSmPDU[4e7f1dff-9a4e-4464-bef4-f110ea8c5196], aged 0:03:05.782633 seconds.
2022-10-07 22:50:19 ERROR    32477 SMPPC [cid:MT_smpp] is not bound: Requeuing (#162) SubmitSmPDU[4e7f1dff-9a4e-4464-bef4-f110ea8c5196], aged 0:03:05.855658 seconds.
2022-10-07 22:50:19 ERROR    32477 SMPPC [cid:MT_smpp] is not bound: Requeuing (#164) SubmitSmPDU[4e7f1dff-9a4e-4464-bef4-f110ea8c5196], aged 0:03:05.928629 seconds.
2022-10-07 22:50:19 ERROR    32477 SMPPC [cid:MT_smpp] is not bound: Requeuing (#166) SubmitSmPDU[4e7f1dff-9a4e-4464-bef4-f110ea8c5196], aged 0:03:06.001310 seconds.
2022-10-07 22:50:19 ERROR    32477 SMPPC [cid:MT_smpp] is not bound: Requeuing (#168) SubmitSmPDU[4e7f1dff-9a4e-4464-bef4-f110ea8c5196], aged 0:03:06.074558 seconds.
2022-10-07 22:50:19 ERROR    32477 SMPPC [cid:MT_smpp] is not bound: Requeuing (#170) SubmitSmPDU[4e7f1dff-9a4e-4464-bef4-f110ea8c5196], aged 0:03:06.147713 seconds.
2022-10-07 22:50:19 ERROR    32477 SMPPC [cid:MT_smpp] is not bound: Requeuing (#172) SubmitSmPDU[4e7f1dff-9a4e-4464-bef4-f110ea8c5196], aged 0:03:06.220798 seconds.

==> /var/log/jasmin/default-MT_smpp.log <==
2022-10-07 22:50:19 ERROR    32477 Request timed out after 10 secs: PDU [command: unbind, sequence_number: 372, command_status: ESME_ROK]
2022-10-07 22:50:19 ERROR    32477 Unbind failed [[Failure instance: Traceback (failure with no frames): <class 'jasmin.vendor.smpp.pdu.error.SMPPRequestTimoutError'>: Request timed out after 10 secs: PDU [command: unbind, sequence_number: 372, command_status: ESME_ROK]]]. Disconnecting...
2022-10-07 22:50:19 WARNING  32477 Disconnecting...
2022-10-07 22:50:19 WARNING  32477 Disconnecting...
2022-10-07 22:50:19 WARNING  32477 Shutdown requested...disconnecting
2022-10-07 22:50:19 WARNING  32477 Disconnecting...
2022-10-07 22:50:19 WARNING  32477 SMPP 10.10.10.10 disconnected from port 35486: [Failure instance: Traceback (failure with no frames): <class 'twisted.internet.error.ConnectionDone'>: Connection was closed cleanly.]
2022-10-07 22:50:19 ERROR    32477 Connection lost. Reason: [Failure instance: Traceback (failure with no frames): <class 'twisted.internet.error.ConnectionDone'>: Connection was closed cleanly.]
2022-10-07 22:50:19 INFO     32477 Reconnecting after 10 seconds ...

==> /var/log/jasmin/messages.log <==
2022-10-07 22:50:19 ERROR    32477 SMPPC [cid:MT_smpp] is not bound: Requeuing (#174) SubmitSmPDU[4e7f1dff-9a4e-4464-bef4-f110ea8c5196], aged 0:03:06.293947 seconds.
2022-10-07 22:50:19 ERROR    32477 SMPPC [cid:MT_smpp] is not bound: Requeuing (#176) SubmitSmPDU[4e7f1dff-9a4e-4464-bef4-f110ea8c5196], aged 0:03:06.367238 seconds.
2022-10-07 22:50:19 ERROR    32477 SMPPC [cid:MT_smpp] is not bound: Requeuing (#178) SubmitSmPDU[4e7f1dff-9a4e-4464-bef4-f110ea8c5196], aged 0:03:06.440334 seconds.
2022-10-07 22:50:19 ERROR    32477 SMPPC [cid:MT_smpp] is not bound: Requeuing (#180) SubmitSmPDU[4e7f1dff-9a4e-4464-bef4-f110ea8c5196], aged 0:03:06.513403 seconds.
2022-10-07 22:50:19 ERROR    32477 SMPPC [cid:MT_smpp] is not bound: Requeuing (#182) SubmitSmPDU[4e7f1dff-9a4e-4464-bef4-f110ea8c5196], aged 0:03:06.586720 seconds.
2022-10-07 22:50:19 ERROR    32477 SMPPC [cid:MT_smpp] is not bound: Requeuing (#184) SubmitSmPDU[4e7f1dff-9a4e-4464-bef4-f110ea8c5196], aged 0:03:06.659847 seconds.
2022-10-07 22:50:20 ERROR    32477 SMPPC [cid:MT_smpp] is not bound: Requeuing (#186) SubmitSmPDU[4e7f1dff-9a4e-4464-bef4-f110ea8c5196], aged 0:03:06.733019 seconds.
2022-10-07 22:50:20 ERROR    32477 SMPPC [cid:MT_smpp] is not bound: Requeuing (#188) SubmitSmPDU[4e7f1dff-9a4e-4464-bef4-f110ea8c5196], aged 0:03:06.806348 seconds.
2022-10-07 22:50:20 ERROR    32477 SMPPC [cid:MT_smpp] is not bound: Requeuing (#190) SubmitSmPDU[4e7f1dff-9a4e-4464-bef4-f110ea8c5196], aged 0:03:06.879385 seconds.
2022-10-07 22:50:20 ERROR    32477 SMPPC [cid:MT_smpp] is not bound: Requeuing (#192) SubmitSmPDU[4e7f1dff-9a4e-4464-bef4-f110ea8c5196], aged 0:03:06.952435 seconds.
2022-10-07 22:50:20 ERROR    32477 SMPPC [cid:MT_smpp] is not bound: Requeuing (#194) SubmitSmPDU[4e7f1dff-9a4e-4464-bef4-f110ea8c5196], aged 0:03:07.025713 seconds.
2022-10-07 22:50:20 ERROR    32477 SMPPC [cid:MT_smpp] is not bound: Requeuing (#196) SubmitSmPDU[4e7f1dff-9a4e-4464-bef4-f110ea8c5196], aged 0:03:07.098851 seconds.
2022-10-07 22:50:20 ERROR    32477 SMPPC [cid:MT_smpp] is not bound: Requeuing (#198) SubmitSmPDU[4e7f1dff-9a4e-4464-bef4-f110ea8c5196], aged 0:03:07.172022 seconds.
2022-10-07 22:50:20 ERROR    32477 SMPPC [cid:MT_smpp] is not bound: Requeuing (#200) SubmitSmPDU[4e7f1dff-9a4e-4464-bef4-f110ea8c5196], aged 0:03:07.245418 seconds.
2022-10-07 22:50:20 ERROR    32477 SMPPC [cid:MT_smpp] is not bound: Requeuing (#202) SubmitSmPDU[4e7f1dff-9a4e-4464-bef4-f110ea8c5196], aged 0:03:07.318412 seconds.
2022-10-07 22:50:20 ERROR    32477 SMPPC [cid:MT_smpp] is not bound: Requeuing (#204) SubmitSmPDU[4e7f1dff-9a4e-4464-bef4-f110ea8c5196], aged 0:03:07.391229 seconds.
2022-10-07 22:50:20 ERROR    32477 SMPPC [cid:MT_smpp] is not bound: Requeuing (#206) SubmitSmPDU[4e7f1dff-9a4e-4464-bef4-f110ea8c5196], aged 0:03:07.464344 seconds.
2022-10-07 22:50:20 ERROR    32477 SMPPC [cid:MT_smpp] is not bound: Requeuing (#208) SubmitSmPDU[4e7f1dff-9a4e-4464-bef4-f110ea8c5196], aged 0:03:07.537291 seconds.
2022-10-07 22:50:20 ERROR    32477 SMPPC [cid:MT_smpp] is not bound: Requeuing (#210) SubmitSmPDU[4e7f1dff-9a4e-4464-bef4-f110ea8c5196], aged 0:03:07.610328 seconds.
2022-10-07 22:50:21 ERROR    32477 SMPPC [cid:MT_smpp] is not bound: Requeuing (#212) SubmitSmPDU[4e7f1dff-9a4e-4464-bef4-f110ea8c5196], aged 0:03:07.683483 seconds.
2022-10-07 22:50:21 ERROR    32477 SMPPC [cid:MT_smpp] is not bound: Requeuing (#214) SubmitSmPDU[4e7f1dff-9a4e-4464-bef4-f110ea8c5196], aged 0:03:07.756468 seconds.
2022-10-07 22:50:21 ERROR    32477 SMPPC [cid:MT_smpp] is not bound: Requeuing (#216) SubmitSmPDU[4e7f1dff-9a4e-4464-bef4-f110ea8c5196], aged 0:03:07.829411 seconds.
2022-10-07 22:50:21 ERROR    32477 SMPPC [cid:MT_smpp] is not bound: Requeuing (#218) SubmitSmPDU[4e7f1dff-9a4e-4464-bef4-f110ea8c5196], aged 0:03:07.902285 seconds.
2022-10-07 22:50:21 ERROR    32477 SMPPC [cid:MT_smpp] is not bound: Requeuing (#220) SubmitSmPDU[4e7f1dff-9a4e-4464-bef4-f110ea8c5196], aged 0:03:07.975047 seconds.
2022-10-07 22:50:21 ERROR    32477 SMPPC [cid:MT_smpp] is not bound: Requeuing (#222) SubmitSmPDU[4e7f1dff-9a4e-4464-bef4-f110ea8c5196], aged 0:03:08.048160 seconds.
2022-10-07 22:50:21 ERROR    32477 SMPPC [cid:MT_smpp] is not bound: Requeuing (#224) SubmitSmPDU[4e7f1dff-9a4e-4464-bef4-f110ea8c5196], aged 0:03:08.121489 seconds.
2022-10-07 22:50:21 ERROR    32477 SMPPC [cid:MT_smpp] is not bound: Requeuing (#226) SubmitSmPDU[4e7f1dff-9a4e-4464-bef4-f110ea8c5196], aged 0:03:08.194572 seconds.
2022-10-07 22:50:21 ERROR    32477 SMPPC [cid:MT_smpp] is not bound: Requeuing (#228) SubmitSmPDU[4e7f1dff-9a4e-4464-bef4-f110ea8c5196], aged 0:03:08.267703 seconds.
2022-10-07 22:50:21 ERROR    32477 SMPPC [cid:MT_smpp] is not bound: Requeuing (#230) SubmitSmPDU[4e7f1dff-9a4e-4464-bef4-f110ea8c5196], aged 0:03:08.340946 seconds.
2022-10-07 22:50:21 ERROR    32477 SMPPC [cid:MT_smpp] is not bound: Requeuing (#232) SubmitSmPDU[4e7f1dff-9a4e-4464-bef4-f110ea8c5196], aged 0:03:08.413936 seconds.
2022-10-07 22:50:21 ERROR    32477 SMPPC [cid:MT_smpp] is not bound: Requeuing (#234) SubmitSmPDU[4e7f1dff-9a4e-4464-bef4-f110ea8c5196], aged 0:03:08.486921 seconds.
2022-10-07 22:50:21 ERROR    32477 SMPPC [cid:MT_smpp] is not bound: Requeuing (#236) SubmitSmPDU[4e7f1dff-9a4e-4464-bef4-f110ea8c5196], aged 0:03:08.560231 seconds.
2022-10-07 22:50:21 ERROR    32477 SMPPC [cid:MT_smpp] is not bound: Requeuing (#238) SubmitSmPDU[4e7f1dff-9a4e-4464-bef4-f110ea8c5196], aged 0:03:08.633357 seconds.
2022-10-07 22:50:22 ERROR    32477 SMPPC [cid:MT_smpp] is not bound: Requeuing (#240) SubmitSmPDU[4e7f1dff-9a4e-4464-bef4-f110ea8c5196], aged 0:03:08.706522 seconds.
2022-10-07 22:50:22 ERROR    32477 SMPPC [cid:MT_smpp] is not bound: Requeuing (#242) SubmitSmPDU[4e7f1dff-9a4e-4464-bef4-f110ea8c5196], aged 0:03:08.779837 seconds.
2022-10-07 22:50:22 ERROR    32477 SMPPC [cid:MT_smpp] is not bound: Requeuing (#244) SubmitSmPDU[4e7f1dff-9a4e-4464-bef4-f110ea8c5196], aged 0:03:08.852920 seconds.
2022-10-07 22:50:22 ERROR    32477 SMPPC [cid:MT_smpp] is not bound: Requeuing (#246) SubmitSmPDU[4e7f1dff-9a4e-4464-bef4-f110ea8c5196], aged 0:03:08.925835 seconds.
2022-10-07 22:50:22 ERROR    32477 SMPPC [cid:MT_smpp] is not bound: Requeuing (#248) SubmitSmPDU[4e7f1dff-9a4e-4464-bef4-f110ea8c5196], aged 0:03:08.998836 seconds.
2022-10-07 22:50:22 ERROR    32477 SMPPC [cid:MT_smpp] is not bound: Requeuing (#250) SubmitSmPDU[4e7f1dff-9a4e-4464-bef4-f110ea8c5196], aged 0:03:09.072077 seconds.
2022-10-07 22:50:22 ERROR    32477 SMPPC [cid:MT_smpp] is not bound: Requeuing (#252) SubmitSmPDU[4e7f1dff-9a4e-4464-bef4-f110ea8c5196], aged 0:03:09.145084 seconds.
2022-10-07 22:50:22 ERROR    32477 SMPPC [cid:MT_smpp] is not bound: Requeuing (#254) SubmitSmPDU[4e7f1dff-9a4e-4464-bef4-f110ea8c5196], aged 0:03:09.218414 seconds.
2022-10-07 22:50:22 ERROR    32477 SMPPC [cid:MT_smpp] is not bound: Requeuing (#256) SubmitSmPDU[4e7f1dff-9a4e-4464-bef4-f110ea8c5196], aged 0:03:09.291450 seconds.
2022-10-07 22:50:22 ERROR    32477 SMPPC [cid:MT_smpp] is not bound: Requeuing (#258) SubmitSmPDU[4e7f1dff-9a4e-4464-bef4-f110ea8c5196], aged 0:03:09.364522 seconds.
2022-10-07 22:50:22 ERROR    32477 SMPPC [cid:MT_smpp] is not bound: Requeuing (#260) SubmitSmPDU[4e7f1dff-9a4e-4464-bef4-f110ea8c5196], aged 0:03:09.437781 seconds.
2022-10-07 22:50:22 ERROR    32477 SMPPC [cid:MT_smpp] is not bound: Requeuing (#262) SubmitSmPDU[4e7f1dff-9a4e-4464-bef4-f110ea8c5196], aged 0:03:09.510911 seconds.
2022-10-07 22:50:22 ERROR    32477 SMPPC [cid:MT_smpp] is not bound: Requeuing (#264) SubmitSmPDU[4e7f1dff-9a4e-4464-bef4-f110ea8c5196], aged 0:03:09.583969 seconds.
2022-10-07 22:50:22 ERROR    32477 SMPPC [cid:MT_smpp] is not bound: Requeuing (#266) SubmitSmPDU[4e7f1dff-9a4e-4464-bef4-f110ea8c5196], aged 0:03:09.657233 seconds.
2022-10-07 22:50:23 ERROR    32477 SMPPC [cid:MT_smpp] is not bound: Requeuing (#268) SubmitSmPDU[4e7f1dff-9a4e-4464-bef4-f110ea8c5196], aged 0:03:09.730254 seconds.
2022-10-07 22:50:23 ERROR    32477 SMPPC [cid:MT_smpp] is not bound: Requeuing (#270) SubmitSmPDU[4e7f1dff-9a4e-4464-bef4-f110ea8c5196], aged 0:03:09.803295 seconds.
2022-10-07 22:50:23 ERROR    32477 SMPPC [cid:MT_smpp] is not bound: Requeuing (#272) SubmitSmPDU[4e7f1dff-9a4e-4464-bef4-f110ea8c5196], aged 0:03:09.876531 seconds.
2022-10-07 22:50:23 ERROR    32477 SMPPC [cid:MT_smpp] is not bound: Requeuing (#274) SubmitSmPDU[4e7f1dff-9a4e-4464-bef4-f110ea8c5196], aged 0:03:09.949543 seconds.
2022-10-07 22:50:23 ERROR    32477 SMPPC [cid:MT_smpp] is not bound: Requeuing (#276) SubmitSmPDU[4e7f1dff-9a4e-4464-bef4-f110ea8c5196], aged 0:03:10.022619 seconds.
2022-10-07 22:50:23 ERROR    32477 SMPPC [cid:MT_smpp] is not bound: Requeuing (#278) SubmitSmPDU[4e7f1dff-9a4e-4464-bef4-f110ea8c5196], aged 0:03:10.095917 seconds.
2022-10-07 22:50:23 ERROR    32477 SMPPC [cid:MT_smpp] is not bound: Requeuing (#280) SubmitSmPDU[4e7f1dff-9a4e-4464-bef4-f110ea8c5196], aged 0:03:10.168981 seconds.
2022-10-07 22:50:23 ERROR    32477 SMPPC [cid:MT_smpp] is not bound: Requeuing (#282) SubmitSmPDU[4e7f1dff-9a4e-4464-bef4-f110ea8c5196], aged 0:03:10.242063 seconds.
2022-10-07 22:50:23 ERROR    32477 SMPPC [cid:MT_smpp] is not bound: Requeuing (#284) SubmitSmPDU[4e7f1dff-9a4e-4464-bef4-f110ea8c5196], aged 0:03:10.315366 seconds.
2022-10-07 22:50:23 ERROR    32477 SMPPC [cid:MT_smpp] is not bound: Requeuing (#286) SubmitSmPDU[4e7f1dff-9a4e-4464-bef4-f110ea8c5196], aged 0:03:10.388436 seconds.
2022-10-07 22:50:23 ERROR    32477 SMPPC [cid:MT_smpp] is not bound: Requeuing (#288) SubmitSmPDU[4e7f1dff-9a4e-4464-bef4-f110ea8c5196], aged 0:03:10.461465 seconds.
2022-10-07 22:50:23 ERROR    32477 SMPPC [cid:MT_smpp] is not bound: Requeuing (#290) SubmitSmPDU[4e7f1dff-9a4e-4464-bef4-f110ea8c5196], aged 0:03:10.534715 seconds.
2022-10-07 22:50:23 ERROR    32477 SMPPC [cid:MT_smpp] is not bound: Requeuing (#292) SubmitSmPDU[4e7f1dff-9a4e-4464-bef4-f110ea8c5196], aged 0:03:10.607823 seconds.
2022-10-07 22:50:24 ERROR    32477 SMPPC [cid:MT_smpp] is not bound: Requeuing (#294) SubmitSmPDU[4e7f1dff-9a4e-4464-bef4-f110ea8c5196], aged 0:03:10.680947 seconds.
2022-10-07 22:50:24 ERROR    32477 SMPPC [cid:MT_smpp] is not bound: Requeuing (#296) SubmitSmPDU[4e7f1dff-9a4e-4464-bef4-f110ea8c5196], aged 0:03:10.754204 seconds.
2022-10-07 22:50:24 ERROR    32477 SMPPC [cid:MT_smpp] is not bound: Requeuing (#298) SubmitSmPDU[4e7f1dff-9a4e-4464-bef4-f110ea8c5196], aged 0:03:10.827313 seconds.
2022-10-07 22:50:24 ERROR    32477 SMPPC [cid:MT_smpp] is not bound: Requeuing (#300) SubmitSmPDU[4e7f1dff-9a4e-4464-bef4-f110ea8c5196], aged 0:03:10.900373 seconds.
2022-10-07 22:50:24 ERROR    32477 SMPPC [cid:MT_smpp] is not bound: Requeuing (#302) SubmitSmPDU[4e7f1dff-9a4e-4464-bef4-f110ea8c5196], aged 0:03:10.973729 seconds.
2022-10-07 22:50:24 ERROR    32477 SMPPC [cid:MT_smpp] is not bound: Requeuing (#304) SubmitSmPDU[4e7f1dff-9a4e-4464-bef4-f110ea8c5196], aged 0:03:11.046822 seconds.
2022-10-07 22:50:24 ERROR    32477 SMPPC [cid:MT_smpp] is not bound: Requeuing (#306) SubmitSmPDU[4e7f1dff-9a4e-4464-bef4-f110ea8c5196], aged 0:03:11.119894 seconds.
2022-10-07 22:50:24 ERROR    32477 SMPPC [cid:MT_smpp] is not bound: Requeuing (#308) SubmitSmPDU[4e7f1dff-9a4e-4464-bef4-f110ea8c5196], aged 0:03:11.198419 seconds.
2022-10-07 22:50:24 ERROR    32477 SMPPC [cid:MT_smpp] is not bound: Requeuing (#310) SubmitSmPDU[4e7f1dff-9a4e-4464-bef4-f110ea8c5196], aged 0:03:11.271467 seconds.
2022-10-07 22:50:24 ERROR    32477 SMPPC [cid:MT_smpp] is not bound: Requeuing (#312) SubmitSmPDU[4e7f1dff-9a4e-4464-bef4-f110ea8c5196], aged 0:03:11.344705 seconds.
2022-10-07 22:50:24 ERROR    32477 SMPPC [cid:MT_smpp] is not bound: Requeuing (#314) SubmitSmPDU[4e7f1dff-9a4e-4464-bef4-f110ea8c5196], aged 0:03:11.417755 seconds.
2022-10-07 22:50:24 ERROR    32477 SMPPC [cid:MT_smpp] is not bound: Requeuing (#316) SubmitSmPDU[4e7f1dff-9a4e-4464-bef4-f110ea8c5196], aged 0:03:11.490586 seconds.
2022-10-07 22:50:24 ERROR    32477 SMPPC [cid:MT_smpp] is not bound: Requeuing (#318) SubmitSmPDU[4e7f1dff-9a4e-4464-bef4-f110ea8c5196], aged 0:03:11.563645 seconds.
2022-10-07 22:50:24 ERROR    32477 SMPPC [cid:MT_smpp] is not bound: Requeuing (#320) SubmitSmPDU[4e7f1dff-9a4e-4464-bef4-f110ea8c5196], aged 0:03:11.637081 seconds.
2022-10-07 22:50:25 ERROR    32477 SMPPC [cid:MT_smpp] is not bound: Requeuing (#322) SubmitSmPDU[4e7f1dff-9a4e-4464-bef4-f110ea8c5196], aged 0:03:11.710114 seconds.
2022-10-07 22:50:25 ERROR    32477 SMPPC [cid:MT_smpp] is not bound: Requeuing (#324) SubmitSmPDU[4e7f1dff-9a4e-4464-bef4-f110ea8c5196], aged 0:03:11.783214 seconds.
2022-10-07 22:50:25 ERROR    32477 SMPPC [cid:MT_smpp] is not bound: Requeuing (#326) SubmitSmPDU[4e7f1dff-9a4e-4464-bef4-f110ea8c5196], aged 0:03:11.856493 seconds.
2022-10-07 22:50:25 ERROR    32477 SMPPC [cid:MT_smpp] is not bound: Requeuing (#328) SubmitSmPDU[4e7f1dff-9a4e-4464-bef4-f110ea8c5196], aged 0:03:11.929382 seconds.
2022-10-07 22:50:25 ERROR    32477 SMPPC [cid:MT_smpp] is not bound: Requeuing (#330) SubmitSmPDU[4e7f1dff-9a4e-4464-bef4-f110ea8c5196], aged 0:03:12.002269 seconds.
2022-10-07 22:50:25 ERROR    32477 SMPPC [cid:MT_smpp] is not bound: Requeuing (#332) SubmitSmPDU[4e7f1dff-9a4e-4464-bef4-f110ea8c5196], aged 0:03:12.075553 seconds.
2022-10-07 22:50:25 ERROR    32477 SMPPC [cid:MT_smpp] is not bound: Requeuing (#334) SubmitSmPDU[4e7f1dff-9a4e-4464-bef4-f110ea8c5196], aged 0:03:12.148611 seconds.
2022-10-07 22:50:25 ERROR    32477 SMPPC [cid:MT_smpp] is not bound: Requeuing (#336) SubmitSmPDU[4e7f1dff-9a4e-4464-bef4-f110ea8c5196], aged 0:03:12.221832 seconds.
2022-10-07 22:50:25 ERROR    32477 SMPPC [cid:MT_smpp] is not bound: Requeuing (#338) SubmitSmPDU[4e7f1dff-9a4e-4464-bef4-f110ea8c5196], aged 0:03:12.295264 seconds.
2022-10-07 22:50:25 ERROR    32477 SMPPC [cid:MT_smpp] is not bound: Requeuing (#340) SubmitSmPDU[4e7f1dff-9a4e-4464-bef4-f110ea8c5196], aged 0:03:12.368380 seconds.
2022-10-07 22:50:25 ERROR    32477 SMPPC [cid:MT_smpp] is not bound: Requeuing (#342) SubmitSmPDU[4e7f1dff-9a4e-4464-bef4-f110ea8c5196], aged 0:03:12.441484 seconds.
2022-10-07 22:50:25 ERROR    32477 SMPPC [cid:MT_smpp] is not bound: Requeuing (#344) SubmitSmPDU[4e7f1dff-9a4e-4464-bef4-f110ea8c5196], aged 0:03:12.514830 seconds.
2022-10-07 22:50:25 ERROR    32477 SMPPC [cid:MT_smpp] is not bound: Requeuing (#346) SubmitSmPDU[4e7f1dff-9a4e-4464-bef4-f110ea8c5196], aged 0:03:12.587917 seconds.
2022-10-07 22:50:25 ERROR    32477 SMPPC [cid:MT_smpp] is not bound: Requeuing (#348) SubmitSmPDU[4e7f1dff-9a4e-4464-bef4-f110ea8c5196], aged 0:03:12.661045 seconds.
2022-10-07 22:50:26 ERROR    32477 SMPPC [cid:MT_smpp] is not bound: Requeuing (#350) SubmitSmPDU[4e7f1dff-9a4e-4464-bef4-f110ea8c5196], aged 0:03:12.734308 seconds.
2022-10-07 22:50:26 ERROR    32477 SMPPC [cid:MT_smpp] is not bound: Requeuing (#352) SubmitSmPDU[4e7f1dff-9a4e-4464-bef4-f110ea8c5196], aged 0:03:12.807329 seconds.
2022-10-07 22:50:26 ERROR    32477 SMPPC [cid:MT_smpp] is not bound: Requeuing (#354) SubmitSmPDU[4e7f1dff-9a4e-4464-bef4-f110ea8c5196], aged 0:03:12.880365 seconds.
2022-10-07 22:50:26 ERROR    32477 SMPPC [cid:MT_smpp] is not bound: Requeuing (#356) SubmitSmPDU[4e7f1dff-9a4e-4464-bef4-f110ea8c5196], aged 0:03:12.953560 seconds.
2022-10-07 22:50:26 ERROR    32477 SMPPC [cid:MT_smpp] is not bound: Requeuing (#358) SubmitSmPDU[4e7f1dff-9a4e-4464-bef4-f110ea8c5196], aged 0:03:13.026650 seconds.
2022-10-07 22:50:26 ERROR    32477 SMPPC [cid:MT_smpp] is not bound: Requeuing (#360) SubmitSmPDU[4e7f1dff-9a4e-4464-bef4-f110ea8c5196], aged 0:03:13.099802 seconds.
2022-10-07 22:50:26 ERROR    32477 SMPPC [cid:MT_smpp] is not bound: Requeuing (#362) SubmitSmPDU[4e7f1dff-9a4e-4464-bef4-f110ea8c5196], aged 0:03:13.172930 seconds.
2022-10-07 22:50:26 ERROR    32477 SMPPC [cid:MT_smpp] is not bound: Requeuing (#364) SubmitSmPDU[4e7f1dff-9a4e-4464-bef4-f110ea8c5196], aged 0:03:13.245780 seconds.
2022-10-07 22:50:26 ERROR    32477 SMPPC [cid:MT_smpp] is not bound: Requeuing (#366) SubmitSmPDU[4e7f1dff-9a4e-4464-bef4-f110ea8c5196], aged 0:03:13.318933 seconds.
2022-10-07 22:50:26 ERROR    32477 SMPPC [cid:MT_smpp] is not bound: Requeuing (#368) SubmitSmPDU[4e7f1dff-9a4e-4464-bef4-f110ea8c5196], aged 0:03:13.392247 seconds.
2022-10-07 22:50:26 ERROR    32477 SMPPC [cid:MT_smpp] is not bound: Requeuing (#370) SubmitSmPDU[4e7f1dff-9a4e-4464-bef4-f110ea8c5196], aged 0:03:13.465223 seconds.
2022-10-07 22:50:26 ERROR    32477 SMPPC [cid:MT_smpp] is not bound: Requeuing (#372) SubmitSmPDU[4e7f1dff-9a4e-4464-bef4-f110ea8c5196], aged 0:03:13.537826 seconds.
2022-10-07 22:50:26 ERROR    32477 SMPPC [cid:MT_smpp] is not bound: Requeuing (#374) SubmitSmPDU[4e7f1dff-9a4e-4464-bef4-f110ea8c5196], aged 0:03:13.611162 seconds.
2022-10-07 22:50:27 ERROR    32477 SMPPC [cid:MT_smpp] is not bound: Requeuing (#376) SubmitSmPDU[4e7f1dff-9a4e-4464-bef4-f110ea8c5196], aged 0:03:13.684235 seconds.
2022-10-07 22:50:27 ERROR    32477 SMPPC [cid:MT_smpp] is not bound: Requeuing (#378) SubmitSmPDU[4e7f1dff-9a4e-4464-bef4-f110ea8c5196], aged 0:03:13.757221 seconds.
2022-10-07 22:50:27 ERROR    32477 SMPPC [cid:MT_smpp] is not bound: Requeuing (#380) SubmitSmPDU[4e7f1dff-9a4e-4464-bef4-f110ea8c5196], aged 0:03:13.830348 seconds.
2022-10-07 22:50:27 ERROR    32477 SMPPC [cid:MT_smpp] is not bound: Requeuing (#382) SubmitSmPDU[4e7f1dff-9a4e-4464-bef4-f110ea8c5196], aged 0:03:13.903390 seconds.
2022-10-07 22:50:27 ERROR    32477 SMPPC [cid:MT_smpp] is not bound: Requeuing (#384) SubmitSmPDU[4e7f1dff-9a4e-4464-bef4-f110ea8c5196], aged 0:03:13.976458 seconds.
2022-10-07 22:50:27 ERROR    32477 SMPPC [cid:MT_smpp] is not bound: Requeuing (#386) SubmitSmPDU[4e7f1dff-9a4e-4464-bef4-f110ea8c5196], aged 0:03:14.049878 seconds.
2022-10-07 22:50:27 ERROR    32477 SMPPC [cid:MT_smpp] is not bound: Requeuing (#388) SubmitSmPDU[4e7f1dff-9a4e-4464-bef4-f110ea8c5196], aged 0:03:14.123046 seconds.
2022-10-07 22:50:27 ERROR    32477 SMPPC [cid:MT_smpp] is not bound: Requeuing (#390) SubmitSmPDU[4e7f1dff-9a4e-4464-bef4-f110ea8c5196], aged 0:03:14.196129 seconds.
2022-10-07 22:50:27 ERROR    32477 SMPPC [cid:MT_smpp] is not bound: Requeuing (#392) SubmitSmPDU[4e7f1dff-9a4e-4464-bef4-f110ea8c5196], aged 0:03:14.269356 seconds.
2022-10-07 22:50:27 ERROR    32477 SMPPC [cid:MT_smpp] is not bound: Requeuing (#394) SubmitSmPDU[4e7f1dff-9a4e-4464-bef4-f110ea8c5196], aged 0:03:14.342410 seconds.
2022-10-07 22:50:27 ERROR    32477 SMPPC [cid:MT_smpp] is not bound: Requeuing (#396) SubmitSmPDU[4e7f1dff-9a4e-4464-bef4-f110ea8c5196], aged 0:03:14.415391 seconds.
2022-10-07 22:50:27 ERROR    32477 SMPPC [cid:MT_smpp] is not bound: Requeuing (#398) SubmitSmPDU[4e7f1dff-9a4e-4464-bef4-f110ea8c5196], aged 0:03:14.488559 seconds.
2022-10-07 22:50:27 ERROR    32477 SMPPC [cid:MT_smpp] is not bound: Requeuing (#400) SubmitSmPDU[4e7f1dff-9a4e-4464-bef4-f110ea8c5196], aged 0:03:14.561623 seconds.
2022-10-07 22:50:27 ERROR    32477 SMPPC [cid:MT_smpp] is not bound: Requeuing (#402) SubmitSmPDU[4e7f1dff-9a4e-4464-bef4-f110ea8c5196], aged 0:03:14.634788 seconds.
2022-10-07 22:50:28 ERROR    32477 SMPPC [cid:MT_smpp] is not bound: Requeuing (#404) SubmitSmPDU[4e7f1dff-9a4e-4464-bef4-f110ea8c5196], aged 0:03:14.708090 seconds.
2022-10-07 22:50:28 ERROR    32477 SMPPC [cid:MT_smpp] is not bound: Requeuing (#406) SubmitSmPDU[4e7f1dff-9a4e-4464-bef4-f110ea8c5196], aged 0:03:14.781080 seconds.
2022-10-07 22:50:28 ERROR    32477 SMPPC [cid:MT_smpp] is not bound: Requeuing (#408) SubmitSmPDU[4e7f1dff-9a4e-4464-bef4-f110ea8c5196], aged 0:03:14.854103 seconds.
2022-10-07 22:50:28 ERROR    32477 SMPPC [cid:MT_smpp] is not bound: Requeuing (#410) SubmitSmPDU[4e7f1dff-9a4e-4464-bef4-f110ea8c5196], aged 0:03:14.927067 seconds.
2022-10-07 22:50:28 ERROR    32477 SMPPC [cid:MT_smpp] is not bound: Requeuing (#412) SubmitSmPDU[4e7f1dff-9a4e-4464-bef4-f110ea8c5196], aged 0:03:15.000012 seconds.
2022-10-07 22:50:28 ERROR    32477 SMPPC [cid:MT_smpp] is not bound: Requeuing (#414) SubmitSmPDU[4e7f1dff-9a4e-4464-bef4-f110ea8c5196], aged 0:03:15.073056 seconds.
2022-10-07 22:50:28 ERROR    32477 SMPPC [cid:MT_smpp] is not bound: Requeuing (#416) SubmitSmPDU[4e7f1dff-9a4e-4464-bef4-f110ea8c5196], aged 0:03:15.146378 seconds.
2022-10-07 22:50:28 ERROR    32477 SMPPC [cid:MT_smpp] is not bound: Requeuing (#418) SubmitSmPDU[4e7f1dff-9a4e-4464-bef4-f110ea8c5196], aged 0:03:15.219405 seconds.
2022-10-07 22:50:28 ERROR    32477 SMPPC [cid:MT_smpp] is not bound: Requeuing (#420) SubmitSmPDU[4e7f1dff-9a4e-4464-bef4-f110ea8c5196], aged 0:03:15.292452 seconds.
2022-10-07 22:50:28 ERROR    32477 SMPPC [cid:MT_smpp] is not bound: Requeuing (#422) SubmitSmPDU[4e7f1dff-9a4e-4464-bef4-f110ea8c5196], aged 0:03:15.365798 seconds.
2022-10-07 22:50:28 ERROR    32477 SMPPC [cid:MT_smpp] is not bound: Requeuing (#424) SubmitSmPDU[4e7f1dff-9a4e-4464-bef4-f110ea8c5196], aged 0:03:15.438897 seconds.
2022-10-07 22:50:28 ERROR    32477 SMPPC [cid:MT_smpp] is not bound: Requeuing (#426) SubmitSmPDU[4e7f1dff-9a4e-4464-bef4-f110ea8c5196], aged 0:03:15.511980 seconds.
2022-10-07 22:50:28 ERROR    32477 SMPPC [cid:MT_smpp] is not bound: Requeuing (#428) SubmitSmPDU[4e7f1dff-9a4e-4464-bef4-f110ea8c5196], aged 0:03:15.585279 seconds.
2022-10-07 22:50:28 ERROR    32477 SMPPC [cid:MT_smpp] is not bound: Requeuing (#430) SubmitSmPDU[4e7f1dff-9a4e-4464-bef4-f110ea8c5196], aged 0:03:15.658383 seconds.
2022-10-07 22:50:29 ERROR    32477 SMPPC [cid:MT_smpp] is not bound: Requeuing (#432) SubmitSmPDU[4e7f1dff-9a4e-4464-bef4-f110ea8c5196], aged 0:03:15.731418 seconds.
2022-10-07 22:50:29 ERROR    32477 SMPPC [cid:MT_smpp] is not bound: Requeuing (#434) SubmitSmPDU[4e7f1dff-9a4e-4464-bef4-f110ea8c5196], aged 0:03:15.804635 seconds.
2022-10-07 22:50:29 ERROR    32477 SMPPC [cid:MT_smpp] is not bound: Requeuing (#436) SubmitSmPDU[4e7f1dff-9a4e-4464-bef4-f110ea8c5196], aged 0:03:15.877533 seconds.
2022-10-07 22:50:29 ERROR    32477 SMPPC [cid:MT_smpp] is not bound: Requeuing (#438) SubmitSmPDU[4e7f1dff-9a4e-4464-bef4-f110ea8c5196], aged 0:03:15.950622 seconds.
2022-10-07 22:50:29 ERROR    32477 SMPPC [cid:MT_smpp] is not bound: Requeuing (#440) SubmitSmPDU[4e7f1dff-9a4e-4464-bef4-f110ea8c5196], aged 0:03:16.023888 seconds.
2022-10-07 22:50:29 ERROR    32477 SMPPC [cid:MT_smpp] is not bound: Requeuing (#442) SubmitSmPDU[4e7f1dff-9a4e-4464-bef4-f110ea8c5196], aged 0:03:16.096893 seconds.
2022-10-07 22:50:29 ERROR    32477 SMPPC [cid:MT_smpp] is not bound: Requeuing (#444) SubmitSmPDU[4e7f1dff-9a4e-4464-bef4-f110ea8c5196], aged 0:03:16.169972 seconds.
2022-10-07 22:50:29 ERROR    32477 SMPPC [cid:MT_smpp] is not bound: Requeuing (#446) SubmitSmPDU[4e7f1dff-9a4e-4464-bef4-f110ea8c5196], aged 0:03:16.242978 seconds.

==> /var/log/jasmin/default-MT_smpp.log <==
2022-10-07 22:50:29 INFO     32477 Connecting to IPv4Address(TCP, '10.10.10.10', 2775) ...
2022-10-07 22:50:29 WARNING  32477 SMPP connection established from 10.10.10.10 to port 49826
2022-10-07 22:50:29 INFO     32477 Connection made to 10.10.10.10:2775
2022-10-07 22:50:29 WARNING  32477 Requesting bind as transceiver

SMPP Connector
-----------------------------
jcli : smppccm -s MT_smpp
ripf 0
con_fail_delay 10
dlr_expiry 86400
coding 0
logrotate midnight
submit_throughput 14
elink_interval 30
bind_to 10
port 2775
con_fail_retry yes
password XXXX
src_addr XXX
bind_npi 0
addr_range None
dst_ton 1
res_to 120
def_msg_id 0
priority 3
con_loss_retry yes
username XXXX
dst_npi 1
validity None
requeue_delay 60
host 10.10.10.10
src_npi 1
trx_to 300
logfile //var/log/jasmin/default-MT_smpp.log
systype
ssl no
cid MT_smpp
loglevel 20
bind transceiver
proto_id None
dlr_msgid 0
con_loss_delay 10
logprivacy no
bind_ton 0
pdu_red_to 10
src_ton 5

Thanks
Geeth

**Comment by farirat** [comment]
You're having timeouts on response pdu collection from your smpp provider, did you check through tcpdump ? every request pdu must have a response within your defined **res_to** parameter (which is 120"), if there's no responses you will run into a big mess !

**Comment by geethupendra** [comment]
Hello Farirat,

Yes I have checked the tcpdump, here i attached the sheet
usually, **res_to** parameter is supposed to increase or decrease ? (best practice)


---------------------------------------------------------------------------------
15:46:00.454944 IP 10.10.10.20.2775 > 172.26.8.85.44734: Flags [P.], seq 3936:3952, ack 3937, win 122, options [nop,nop,TS val 2031642237 ecr 798803225], length 16
15:46:08.930368 IP 10.10.10.10.2775 > 172.26.8.85.38552: Flags [P.], seq 8816:8832, ack 4235, win 114, options [nop,nop,TS val 69959930 ecr 1638558366], length 16
15:46:28.074810 IP 10.10.10.10.2775 > 172.26.8.85.46836: Flags [P.], seq 32335:32351, ack 26992, win 501, options [nop,nop,TS val 69979074 ecr 1638577510], length 16
15:46:30.498337 IP 10.10.10.20.2775 > 172.26.8.85.44734: Flags [P.], seq 3952:3968, ack 3953, win 122, options [nop,nop,TS val 2031672279 ecr 798833263], length 16
15:46:38.969669 IP 10.10.10.10.2775 > 172.26.8.85.38552: Flags [P.], seq 8832:8848, ack 4251, win 114, options [nop,nop,TS val 69989969 ecr 1638588405], length 16
15:46:55.713447 IP 10.10.10.10.2775 > 172.26.8.85.46836: Flags [P.], seq 32351:32380, ack 27146, win 501, options [nop,nop,TS val 70006713 ecr 1638605147], length 29
15:46:56.318840 IP 10.10.10.10.2775 > 172.26.8.85.46836: Flags [P.], seq 32380:32570, ack 27146, win 501, options [nop,nop,TS val 70007318 ecr 1638605187], length 190
15:46:56.399508 IP 10.10.10.10.2775 > 172.26.8.85.46836: Flags [.], ack 27163, win 501, options [nop,nop,TS val 70007399 ecr 1638605795], length 0
15:47:00.541614 IP 10.10.10.20.2775 > 172.26.8.85.44734: Flags [P.], seq 3968:3984, ack 3969, win 122, options [nop,nop,TS val 2031702323 ecr 798863307], length 16
15:47:09.015810 IP 10.10.10.10.2775 > 172.26.8.85.38552: Flags [P.], seq 8848:8864, ack 4267, win 114, options [nop,nop,TS val 70020011 ecr 1638618444], length 16
15:47:26.371036 IP 10.10.10.10.2775 > 172.26.8.85.46836: Flags [.], ack 27179, win 501, options [nop,nop,TS val 70037364 ecr 1638635795], length 0
15:47:26.371036 IP 10.10.10.10.2775 > 172.26.8.85.46836: Flags [P.], seq 32570:32586, ack 27179, win 501, options [nop,nop,TS val 70037364 ecr 1638635795], length 16
15:47:30.580245 IP 10.10.10.20.2775 > 172.26.8.85.44734: Flags [P.], seq 3984:4000, ack 3985, win 122, options [nop,nop,TS val 2031732361 ecr 798893350], length 16
15:47:39.059540 IP 10.10.10.10.2775 > 172.26.8.85.38552: Flags [P.], seq 8864:8880, ack 4283, win 114, options [nop,nop,TS val 70050056 ecr 1638648490], length 16
15:47:56.412189 IP 10.10.10.10.2775 > 172.26.8.85.46836: Flags [P.], seq 32586:32602, ack 27195, win 501, options [nop,nop,TS val 70067410 ecr 1638665845], length 16
15:48:00.618512 IP 10.10.10.20.2775 > 172.26.8.85.44734: Flags [P.], seq 4000:4016, ack 4001, win 122, options [nop,nop,TS val 2031762399 ecr 798923389], length 16
15:48:09.098488 IP 10.10.10.10.2775 > 172.26.8.85.38552: Flags [P.], seq 8880:8896, ack 4299, win 114, options [nop,nop,TS val 70080097 ecr 1638678534], length 16
15:48:26.450758 IP 10.10.10.10.2775 > 172.26.8.85.46836: Flags [P.], seq 32602:32618, ack 27211, win 501, options [nop,nop,TS val 70097449 ecr 1638695887], length 16
15:48:30.656996 IP 10.10.10.20.2775 > 172.26.8.85.44734: Flags [P.], seq 4016:4032, ack 4017, win 122, options [nop,nop,TS val 2031792438 ecr 798953427], length 16
15:48:39.138065 IP 10.10.10.10.2775 > 172.26.8.85.38552: Flags [P.], seq 8896:8912, ack 4315, win 114, options [nop,nop,TS val 70110136 ecr 1638708573], length 16
15:48:56.489325 IP 10.10.10.10.2775 > 172.26.8.85.46836: Flags [P.], seq 32618:32634, ack 27227, win 501, options [nop,nop,TS val 70127487 ecr 1638725925], length 16
15:49:00.695445 IP 10.10.10.20.2775 > 172.26.8.85.44734: Flags [P.], seq 4032:4048, ack 4033, win 122, options [nop,nop,TS val 2031822476 ecr 798983465], length 16
15:49:09.176755 IP 10.10.10.10.2775 > 172.26.8.85.38552: Flags [P.], seq 8912:8928, ack 4331, win 114, options [nop,nop,TS val 70140175 ecr 1638738612], length 16
15:49:26.527966 IP 10.10.10.10.2775 > 172.26.8.85.46836: Flags [P.], seq 32634:32650, ack 27243, win 501, options [nop,nop,TS val 70157526 ecr 1638755964], length 16
15:49:29.990985 IP 10.10.10.10.2775 > 172.26.8.85.46836: Flags [P.], seq 32650:32679, ack 27395, win 501, options [nop,nop,TS val 70160988 ecr 1638759422], length 29
15:49:30.737208 IP 10.10.10.20.2775 > 172.26.8.85.44734: Flags [P.], seq 4048:4064, ack 4049, win 122, options [nop,nop,TS val 2031852515 ecr 799013504], length 16
15:49:33.390507 IP 10.10.10.10.2775 > 172.26.8.85.46836: Flags [.], ack 27549, win 501, options [nop,nop,TS val 70164375 ecr 1638762772], length 0
15:49:33.422243 IP 10.10.10.10.2775 > 172.26.8.85.46836: Flags [P.], seq 32679:32708, ack 27549, win 501, options [nop,nop,TS val 70164406 ecr 1638762772], length 29
15:49:36.632922 IP 10.10.10.10.2775 > 172.26.8.85.46836: Flags [P.], seq 32708:32898, ack 27549, win 501, options [nop,nop,TS val 70167619 ecr 1638762896], length 190
15:49:36.683905 IP 10.10.10.10.2775 > 172.26.8.85.46836: Flags [.], ack 27566, win 501, options [nop,nop,TS val 70167671 ecr 1638766109], length 0
15:49:39.215481 IP 10.10.10.10.2775 > 172.26.8.85.38552: Flags [P.], seq 8928:8944, ack 4347, win 114, options [nop,nop,TS val 70170213 ecr 1638768651], length 16
15:49:58.246992 IP 10.10.10.10.2775 > 172.26.8.85.38552: Flags [P.], seq 8944:9134, ack 4347, win 114, options [nop,nop,TS val 70189244 ecr 1638768689], length 190
15:49:58.327300 IP 10.10.10.10.2775 > 172.26.8.85.38552: Flags [.], ack 4364, win 114, options [nop,nop,TS val 70189325 ecr 1638787723], length 0
15:50:00.776090 IP 10.10.10.20.2775 > 172.26.8.85.44734: Flags [P.], seq 4064:4080, ack 4065, win 122, options [nop,nop,TS val 2031882555 ecr 799043546], length 16
15:50:06.682847 IP 10.10.10.10.2775 > 172.26.8.85.46836: Flags [.], ack 27582, win 501, options [nop,nop,TS val 70197679 ecr 1638796110], length 0
15:50:06.682907 IP 10.10.10.10.2775 > 172.26.8.85.46836: Flags [P.], seq 32898:32914, ack 27582, win 501, options [nop,nop,TS val 70197680 ecr 1638796110], length 16
15:50:28.295509 IP 10.10.10.10.2775 > 172.26.8.85.38552: Flags [.], ack 4380, win 114, options [nop,nop,TS val 70219292 ecr 1638817724], length 0
15:50:28.295560 IP 10.10.10.10.2775 > 172.26.8.85.38552: Flags [P.], seq 9134:9150, ack 4380, win 114, options [nop,nop,TS val 70219292 ecr 1638817724], length 16
15:50:30.815221 IP 10.10.10.20.2775 > 172.26.8.85.44734: Flags [P.], seq 4080:4096, ack 4081, win 122, options [nop,nop,TS val 2031912594 ecr 799073584], length 16
15:50:36.727697 IP 10.10.10.10.2775 > 172.26.8.85.46836: Flags [P.], seq 32914:32930, ack 27598, win 501, options [nop,nop,TS val 70227725 ecr 1638826157], length 16
15:50:39.658780 IP 10.10.10.10.2775 > 172.26.8.85.46836: Flags [P.], seq 32930:33120, ack 27598, win 501, options [nop,nop,TS val 70230656 ecr 1638826201], length 190
15:50:39.744623 IP 10.10.10.10.2775 > 172.26.8.85.46836: Flags [.], ack 27615, win 501, options [nop,nop,TS val 70230742 ecr 1638829135], length 0
15:50:45.547293 IP 10.10.10.10.2775 > 172.26.8.85.46836: Flags [.], ack 27769, win 501, options [nop,nop,TS val 70236542 ecr 1638834976], length 0
15:50:45.553362 IP 10.10.10.10.2775 > 172.26.8.85.46836: Flags [P.], seq 33120:33149, ack 27769, win 501, options [nop,nop,TS val 70236550 ecr 1638834976], length 29
15:50:58.334369 IP 10.10.10.10.2775 > 172.26.8.85.38552: Flags [P.], seq 9150:9166, ack 4396, win 114, options [nop,nop,TS val 70249331 ecr 1638847770], length 16
15:51:00.853899 IP 10.10.10.20.2775 > 172.26.8.85.44734: Flags [P.], seq 4096:4112, ack 4097, win 122, options [nop,nop,TS val 2031942633 ecr 799103624], length 16
15:55:18.381419 IP 10.10.10.10.2775 > 172.26.8.85.52486: Flags [S.], seq 2955177066, ack 2764651034, win 14480, options [mss 1380,sackOK,TS val 70509381 ecr 1639107815,nop,wscale 7], length 0
15:55:18.423101 IP 10.10.10.10.2775 > 172.26.8.85.52486: Flags [.], ack 35, win 114, options [nop,nop,TS val 70509423 ecr 1639107857], length 0
15:55:18.432929 IP 10.10.10.10.2775 > 172.26.8.85.52486: Flags [P.], seq 1:30, ack 35, win 114, options [nop,nop,TS val 70509434 ecr 1639107857], length 29
15:55:20.898371 IP 10.10.10.20.2775 > 172.26.8.85.40446: Flags [S.], seq 2813687655, ack 3455717636, win 14480, options [mss 1380,sackOK,TS val 2032202682 ecr 799363667,nop,wscale 7], length 0
15:55:20.938564 IP 10.10.10.20.2775 > 172.26.8.85.40446: Flags [.], ack 35, win 114, options [nop,nop,TS val 2032202722 ecr 799363707], length 0
15:55:20.950593 IP 10.10.10.20.2775 > 172.26.8.85.40446: Flags [P.], seq 1:30, ack 35, win 114, options [nop,nop,TS val 2032202735 ecr 799363707], length 29
15:55:25.912899 IP 10.10.10.10.2775 > 172.26.8.85.41728: Flags [S.], seq 2591341798, ack 353301930, win 14480, options [mss 1380,sackOK,TS val 70516915 ecr 1639115348,nop,wscale 7], length 0
15:55:25.952574 IP 10.10.10.10.2775 > 172.26.8.85.41728: Flags [.], ack 35, win 114, options [nop,nop,TS val 70516955 ecr 1639115388], length 0
15:55:25.968037 IP 10.10.10.10.2775 > 172.26.8.85.41728: Flags [P.], seq 1:30, ack 35, win 114, options [nop,nop,TS val 70516969 ecr 1639115388], length 29
15:55:26.027812 IP 10.10.10.10.2775 > 172.26.8.85.41728: Flags [P.], seq 30:59, ack 189, win 122, options [nop,nop,TS val 70517028 ecr 1639115457], length 29
15:55:26.117443 IP 10.10.10.10.2775 > 172.26.8.85.41728: Flags [P.], seq 59:88, ack 343, win 130, options [nop,nop,TS val 70517119 ecr 1639115549], length 29
15:55:32.286129 IP 10.10.10.10.2775 > 172.26.8.85.41728: Flags [P.], seq 88:117, ack 497, win 139, options [nop,nop,TS val 70523287 ecr 1639121716], length 29
15:55:32.359449 IP 10.10.10.10.2775 > 172.26.8.85.41728: Flags [P.], seq 117:307, ack 497, win 139, options [nop,nop,TS val 70523361 ecr 1639121760], length 190
15:55:32.440349 IP 10.10.10.10.2775 > 172.26.8.85.41728: Flags [.], ack 514, win 139, options [nop,nop,TS val 70523443 ecr 1639121836], length 0
15:55:48.474197 IP 10.10.10.10.2775 > 172.26.8.85.52486: Flags [P.], seq 30:46, ack 51, win 114, options [nop,nop,TS val 70539475 ecr 1639137908], length 16
15:55:51.020252 IP 10.10.10.20.2775 > 172.26.8.85.40446: Flags [P.], seq 30:46, ack 51, win 114, options [nop,nop,TS val 2032232799 ecr 799393759], length 16
15:56:02.400694 IP 10.10.10.10.2775 > 172.26.8.85.41728: Flags [.], ack 530, win 139, options [nop,nop,TS val 70553404 ecr 1639151836], length 0
15:56:02.400916 IP 10.10.10.10.2775 > 172.26.8.85.41728: Flags [P.], seq 307:323, ack 530, win 139, options [nop,nop,TS val 70553404 ecr 1639151836], length 16
15:56:05.924143 IP 10.10.10.10.2775 > 172.26.8.85.41728: Flags [P.], seq 323:352, ack 684, win 147, options [nop,nop,TS val 70556927 ecr 1639155347], length 29
15:56:18.513526 IP 10.10.10.10.2775 > 172.26.8.85.52486: Flags [P.], seq 46:62, ack 67, win 114, options [nop,nop,TS val 70569517 ecr 1639167949], length 16
15:56:21.063065 IP 10.10.10.20.2775 > 172.26.8.85.40446: Flags [P.], seq 46:62, ack 67, win 114, options [nop,nop,TS val 2032262847 ecr 799423829], length 16
15:56:33.448392 IP 10.10.10.10.2775 > 172.26.8.85.41728: Flags [P.], seq 352:381, ack 847, win 155, options [nop,nop,TS val 70584451 ecr 1639182880], length 29
15:56:38.977163 IP 10.10.10.10.2775 > 172.26.8.85.41728: Flags [P.], seq 381:571, ack 847, win 155, options [nop,nop,TS val 70589981 ecr 1639182922], length 190
15:56:39.058636 IP 10.10.10.10.2775 > 172.26.8.85.41728: Flags [.], ack 864, win 155, options [nop,nop,TS val 70590063 ecr 1639188453], length 0
15:56:48.552851 IP 10.10.10.10.2775 > 172.26.8.85.52486: Flags [P.], seq 62:78, ack 83, win 114, options [nop,nop,TS val 70599557 ecr 1639197988], length 16
15:56:51.102223 IP 10.10.10.20.2775 > 172.26.8.85.40446: Flags [P.], seq 62:78, ack 83, win 114, options [nop,nop,TS val 2032292889 ecr 799453871], length 16
15:57:09.017954 IP 10.10.10.10.2775 > 172.26.8.85.41728: Flags [.], ack 880, win 155, options [nop,nop,TS val 70620023 ecr 1639218453], length 0
15:57:09.018071 IP 10.10.10.10.2775 > 172.26.8.85.41728: Flags [P.], seq 571:587, ack 880, win 155, options [nop,nop,TS val 70620023 ecr 1639218453], length 16
15:57:18.593013 IP 10.10.10.10.2775 > 172.26.8.85.52486: Flags [P.], seq 78:94, ack 99, win 114, options [nop,nop,TS val 70629597 ecr 1639228027], length 16
15:57:21.141674 IP 10.10.10.20.2775 > 172.26.8.85.40446: Flags [P.], seq 78:94, ack 99, win 114, options [nop,nop,TS val 2032322929 ecr 799483911], length 16
15:57:24.879706 IP 10.10.10.10.2775 > 172.26.8.85.41728: Flags [P.], seq 587:781, ack 880, win 155, options [nop,nop,TS val 70635885 ecr 1639218535], length 194
15:57:24.960169 IP 10.10.10.10.2775 > 172.26.8.85.41728: Flags [.], ack 897, win 155, options [nop,nop,TS val 70635966 ecr 1639234356], length 0
15:57:48.633580 IP 10.10.10.10.2775 > 172.26.8.85.52486: Flags [P.], seq 94:110, ack 115, win 114, options [nop,nop,TS val 70659638 ecr 1639258067], length 16
15:57:51.186366 IP 10.10.10.20.2775 > 172.26.8.85.40446: Flags [P.], seq 94:110, ack 115, win 114, options [nop,nop,TS val 2032352973 ecr 799513950], length 16
15:57:54.128389 IP 10.10.10.10.2775 > 172.26.8.85.41728: Flags [.], ack 1051, win 164, options [nop,nop,TS val 70665135 ecr 1639263564], length 0
15:57:54.133061 IP 10.10.10.10.2775 > 172.26.8.85.41728: Flags [P.], seq 781:810, ack 1051, win 164, options [nop,nop,TS val 70665138 ecr 1639263564], length 29
15:58:18.674204 IP 10.10.10.10.2775 > 172.26.8.85.52486: Flags [P.], seq 110:126, ack 131, win 114, options [nop,nop,TS val 70689679 ecr 1639288108], length 16
15:58:21.074704 IP 10.10.10.10.2775 > 172.26.8.85.52486: Flags [P.], seq 126:316, ack 131, win 114, options [nop,nop,TS val 70692081 ecr 1639288148], length 190
15:58:21.154946 IP 10.10.10.10.2775 > 172.26.8.85.52486: Flags [.], ack 148, win 114, options [nop,nop,TS val 70692162 ecr 1639290551], length 0

----------------------------------

Thanks
Geeth

**Comment by bss-haresh-makwana** [comment]
Hi,

Facing same issue. We have tried with res_to = 600 as well but no luck.
Highly appreciate if anyone can help on it.

Thanks
Haresh

**Comment by Bardzik** [comment]
Hi All!

we have experienced the exact same problem today and I am wondering is there a way to secure ourselves from external SMPP operators failure? 

For example, is there a way to configure FailoverRoute in such a way for it to disconnect/unbind a rogue SMPPc, so that the router won't take it into account when performing getRouteFor() ? 

Kind Regards, 
GB

**Comment by Pandi1981** [comment]
@geethupendra I am also facing the same issue please suggest me what value need to set for res_to...
